{
  "platform": "xhs",
  "type": "detail",
  "ids": [
    "https://www.xiaohongshu.com/explore/64b95d01000000000c034587?xsec_token=AB0EFqJvINCkj6xOCKCQgfNNh8GdnBC_6XecG4QOddo3Q=&xsec_source=pc_cfeed"
  ],
  "enable_get_comments": true,
  "max_comments": 20,
  "cdp_port": 9222,
  "output_dir": "/Users/chaihao/.proma/agent-workspaces/proma-mit/project/workspace-files/ma-media-crawler",
  "output_filename": "xhs_detail_example.csv"
}
